{
  "implementation": [
    {
      "implementation_id": "mister-turbografx16",
      "name": "Turbo Grafx16 (MiSTer)",
      "kind_id": "fpga_hdl",
      "project_id": "mister-devel",
      "repo_url": "https://github.com/MiSTer-devel/TurboGrafx16_MiSTer",
      "hdl_language_id": "mixed",
      "license_id": "GPL-2.0-or-later",
      "last_reviewed": "2026-07-28",
      "notes": "Source availability (T5.4): open -- the repository carries 32 HDL source files (7 systemverilog, 5 verilog, 20 vhdl) alongside 53 prebuilt .rbf binaries. There is no open_source column in the delivered schema (data-model.md §1.9 deleted the proposed core table together with its flags); the presence of hdl_language_id and of implementation_path rows is how that fact is stated here. Machine mapping: hand-mapped, not MRA-setname-derived -- a console core ships no MRA files. The core reimplements the PC Engine, its US TurboGrafx-16 badge and the SuperGrafx, which MAME files as variants of one parent, giving machine_id pce and MAME tg16 -> machine_id pce and MAME sgx -> machine_id pce. Every id was checked against extract/machine.json; MAME's own cloneof relation supplied the parent where the obvious shortname is a clone. License: the repository has no LICENSE, COPYING or COPYRIGHT file; the grant lives in the source header at https://github.com/MiSTer-devel/TurboGrafx16_MiSTer/blob/master/TurboGrafx16.sv, which offers the work under the GNU General Public License \"either version 2 of the License, or (at your option) any later version\" -- hence GPL-2.0-or-later. hdl_language_id: no single HDL family reaches 90% of the 32 source files (7 systemverilog, 5 verilog, 20 vhdl), excluding the shared framework directory. accuracy_id omitted: the repository makes no timing-fidelity claim this build could verify."
    }
  ],
  "implementation_machine": [
    {
      "implementation_id": "mister-turbografx16",
      "machine_id": "pce"
    }
  ],
  "implementation_path": [
    {
      "implementation_id": "mister-turbografx16",
      "path": "TurboGrafx16.sv",
      "is_top": 1
    },
    {
      "implementation_id": "mister-turbografx16",
      "path": "rtl"
    }
  ],
  "implementation_platform": [
    {
      "implementation_id": "mister-turbografx16",
      "platform_id": "mister"
    }
  ]
}
