{
  "implementation": [
    {
      "implementation_id": "mister-arcade-digdug",
      "name": "Dig Dug (MiSTer)",
      "kind_id": "fpga_hdl",
      "project_id": "mister-devel",
      "repo_url": "https://github.com/MiSTer-devel/Arcade-DigDug_MiSTer",
      "hdl_language_id": "verilog",
      "last_reviewed": "2026-07-28",
      "notes": "Source availability (T5.4): open -- the repository carries 23 HDL source files (1 systemverilog, 22 verilog) alongside 12 prebuilt .rbf binaries. There is no open_source column in the delivered schema (data-model.md §1.9 deleted the proposed core table together with its flags); the presence of hdl_language_id and of implementation_path rows is how that fact is stated here. Machine mapping: 1 MRA files in the repository's releases/ directory carry a <setname>; 1 resolved exactly to a MAME 0.288 machine and 0 through MAME's own cloneof relation to the parent set that survives extract/machine.json's parents-only filter, giving 1 distinct machine_id rows. license_id omitted: https://github.com/MiSTer-devel/Arcade-DigDug_MiSTer/blob/master/LICENSE is the verbatim GNU GPL version 3 text, but neither only-this-version nor any-later-version is stated there or in the HDL headers read (Arcade-DigDug.sv), and GPL's version scope comes from the grant, not the licence text. GPL-3.0-only and GPL-3.0-or-later are both consistent with what the repository actually says. hdl_language_id: 22 of 23 HDL files are verilog (1 systemverilog, 22 verilog), excluding the shared framework directory. accuracy_id omitted: the repository makes no timing-fidelity claim this build could verify."
    }
  ],
  "implementation_dependency": [
    {
      "consumer_id": "mister-arcade-digdug",
      "provider_id": "tv80",
      "note": "TV80 Z80 core vendored at rtl/cpu/tv80_core.v"
    }
  ],
  "implementation_machine": [
    {
      "implementation_id": "mister-arcade-digdug",
      "machine_id": "digdug"
    }
  ],
  "implementation_path": [
    {
      "implementation_id": "mister-arcade-digdug",
      "path": "Arcade-DigDug.sv",
      "is_top": 1
    },
    {
      "implementation_id": "mister-arcade-digdug",
      "path": "rtl"
    }
  ],
  "implementation_platform": [
    {
      "implementation_id": "mister-arcade-digdug",
      "platform_id": "mister"
    }
  ]
}
