{
  "implementation": [
    {
      "implementation_id": "mister-arcade-taitosystemsj",
      "name": "Taito System SJ (MiSTer)",
      "kind_id": "fpga_hdl",
      "project_id": "mister-devel",
      "repo_url": "https://github.com/MiSTer-devel/Arcade-TaitoSystemSJ_MiSTer",
      "hdl_language_id": "mixed",
      "last_reviewed": "2026-07-28",
      "notes": "Source availability (T5.4): open -- the repository carries 76 HDL source files (3 systemverilog, 44 verilog, 29 vhdl) alongside 1 prebuilt .rbf binaries. There is no open_source column in the delivered schema (data-model.md §1.9 deleted the proposed core table together with its flags); the presence of hdl_language_id and of implementation_path rows is how that fact is stated here. Machine mapping: 26 MRA files in the repository's releases/ directory carry a <setname>; 15 resolved exactly to a MAME 0.288 machine and 11 through MAME's own cloneof relation to the parent set that survives extract/machine.json's parents-only filter, giving 15 distinct machine_id rows. license_id omitted: https://github.com/MiSTer-devel/Arcade-TaitoSystemSJ_MiSTer/blob/main/LICENSE is the verbatim GNU GPL version 3 text, but neither only-this-version nor any-later-version is stated there or in the HDL headers read (Arcade-TaitoSJ.sv), and GPL's version scope comes from the grant, not the licence text. GPL-3.0-only and GPL-3.0-or-later are both consistent with what the repository actually says. hdl_language_id: no single HDL family reaches 90% of the 76 source files (3 systemverilog, 44 verilog, 29 vhdl), excluding the shared framework directory. accuracy_id omitted: the repository makes no timing-fidelity claim this build could verify."
    }
  ],
  "implementation_dependency": [
    {
      "consumer_id": "mister-arcade-taitosystemsj",
      "provider_id": "jt49",
      "note": "JT49 AY-3-8910 core vendored at modules/sound-jt49/hdl/jt49.v"
    },
    {
      "consumer_id": "mister-arcade-taitosystemsj",
      "provider_id": "t80",
      "note": "T80 Z80 core vendored at modules/cpu-t80/T80.vhd"
    }
  ],
  "implementation_machine": [
    {
      "implementation_id": "mister-arcade-taitosystemsj",
      "machine_id": "adcanoe"
    },
    {
      "implementation_id": "mister-arcade-taitosystemsj",
      "machine_id": "alpine"
    },
    {
      "implementation_id": "mister-arcade-taitosystemsj",
      "machine_id": "bioatack"
    },
    {
      "implementation_id": "mister-arcade-taitosystemsj",
      "machine_id": "elevator"
    },
    {
      "implementation_id": "mister-arcade-taitosystemsj",
      "machine_id": "frontlin"
    },
    {
      "implementation_id": "mister-arcade-taitosystemsj",
      "machine_id": "hwrace"
    },
    {
      "implementation_id": "mister-arcade-taitosystemsj",
      "machine_id": "junglek"
    },
    {
      "implementation_id": "mister-arcade-taitosystemsj",
      "machine_id": "kikstart"
    },
    {
      "implementation_id": "mister-arcade-taitosystemsj",
      "machine_id": "sfposeid"
    },
    {
      "implementation_id": "mister-arcade-taitosystemsj",
      "machine_id": "spacecr"
    },
    {
      "implementation_id": "mister-arcade-taitosystemsj",
      "machine_id": "spaceskr"
    },
    {
      "implementation_id": "mister-arcade-taitosystemsj",
      "machine_id": "timetunl"
    },
    {
      "implementation_id": "mister-arcade-taitosystemsj",
      "machine_id": "tinstar"
    },
    {
      "implementation_id": "mister-arcade-taitosystemsj",
      "machine_id": "waterski"
    },
    {
      "implementation_id": "mister-arcade-taitosystemsj",
      "machine_id": "wwestern"
    }
  ],
  "implementation_path": [
    {
      "implementation_id": "mister-arcade-taitosystemsj",
      "path": "Arcade-TaitoSJ.sv",
      "is_top": 1
    },
    {
      "implementation_id": "mister-arcade-taitosystemsj",
      "path": "rtl"
    }
  ],
  "implementation_platform": [
    {
      "implementation_id": "mister-arcade-taitosystemsj",
      "platform_id": "mister"
    }
  ]
}
