{
  "implementation": [
    {
      "implementation_id": "mister-arcade-bubsys",
      "name": "Bub Sys (MiSTer)",
      "kind_id": "fpga_hdl",
      "project_id": "mister-devel",
      "repo_url": "https://github.com/MiSTer-devel/Arcade-BubSys_MiSTer",
      "hdl_language_id": "mixed",
      "license_id": "GPL-2.0-or-later",
      "last_reviewed": "2026-07-28",
      "notes": "Source availability (T5.4): open -- the repository carries 87 HDL source files (4 systemverilog, 74 verilog, 9 vhdl) alongside 1 prebuilt .rbf binaries. There is no open_source column in the delivered schema (data-model.md §1.9 deleted the proposed core table together with its flags); the presence of hdl_language_id and of implementation_path rows is how that fact is stated here. Machine mapping: 1 MRA files in the repository's releases/ directory carry a <setname>; 1 resolved exactly to a MAME 0.288 machine and 0 through MAME's own cloneof relation to the parent set that survives extract/machine.json's parents-only filter, giving 1 distinct machine_id rows. License: https://github.com/MiSTer-devel/Arcade-BubSys_MiSTer/blob/main/LICENSE is the verbatim GNU GPL version 2 text, and the grant in https://github.com/MiSTer-devel/Arcade-BubSys_MiSTer/blob/main/BubSys.sv reads \"either version 2 of the License, or (at your option) any later version\" -- hence GPL-2.0-or-later. hdl_language_id: no single HDL family reaches 90% of the 87 source files (4 systemverilog, 74 verilog, 9 vhdl), excluding the shared framework directory. accuracy_id omitted: the repository makes no timing-fidelity claim this build could verify."
    }
  ],
  "implementation_dependency": [
    {
      "consumer_id": "mister-arcade-bubsys",
      "provider_id": "fx68k",
      "note": "FX68K 68000 core vendored at rtl/ipcores/fx68k/fx68k.sv"
    },
    {
      "consumer_id": "mister-arcade-bubsys",
      "provider_id": "jt49",
      "note": "JT49 AY-3-8910 core vendored at rtl/ipcores/jt49/jt49.v"
    },
    {
      "consumer_id": "mister-arcade-bubsys",
      "provider_id": "t80",
      "note": "T80 Z80 core vendored at rtl/ipcores/t80/T80.vhd"
    }
  ],
  "implementation_machine": [
    {
      "implementation_id": "mister-arcade-bubsys",
      "machine_id": "twinbeeb"
    }
  ],
  "implementation_path": [
    {
      "implementation_id": "mister-arcade-bubsys",
      "path": "BubSys.sv",
      "is_top": 1
    },
    {
      "implementation_id": "mister-arcade-bubsys",
      "path": "rtl"
    }
  ],
  "implementation_platform": [
    {
      "implementation_id": "mister-arcade-bubsys",
      "platform_id": "mister"
    }
  ]
}
