{
  "implementation": [
    {
      "implementation_id": "mister-arcade-scramble",
      "name": "Scramble (MiSTer)",
      "kind_id": "fpga_hdl",
      "project_id": "mister-devel",
      "repo_url": "https://github.com/MiSTer-devel/Arcade-Scramble_MiSTer",
      "hdl_language_id": "mixed",
      "license_id": "GPL-2.0-or-later",
      "last_reviewed": "2026-07-28",
      "notes": "Source availability (T5.4): open -- the repository carries 23 HDL source files (3 systemverilog, 4 verilog, 16 vhdl) alongside 20 prebuilt .rbf binaries. There is no open_source column in the delivered schema (data-model.md §1.9 deleted the proposed core table together with its flags); the presence of hdl_language_id and of implementation_path rows is how that fact is stated here. Machine mapping: 21 MRA files in the repository's releases/ directory carry a <setname>; 18 resolved exactly to a MAME 0.288 machine and 3 through MAME's own cloneof relation to the parent set that survives extract/machine.json's parents-only filter, giving 21 distinct machine_id rows. License: the repository has no LICENSE, COPYING or COPYRIGHT file; the grant lives in the source header at https://github.com/MiSTer-devel/Arcade-Scramble_MiSTer/blob/master/Arcade-Scramble.sv, which offers the work under the GNU General Public License \"either version 2 of the License, or (at your option) any later version\" -- hence GPL-2.0-or-later. hdl_language_id: no single HDL family reaches 90% of the 23 source files (3 systemverilog, 4 verilog, 16 vhdl), excluding the shared framework directory. accuracy_id omitted: the repository makes no timing-fidelity claim this build could verify."
    }
  ],
  "implementation_dependency": [
    {
      "consumer_id": "mister-arcade-scramble",
      "provider_id": "t80",
      "note": "T80 Z80 core vendored at rtl/T80/T80.vhd"
    }
  ],
  "implementation_machine": [
    {
      "implementation_id": "mister-arcade-scramble",
      "machine_id": "amidar"
    },
    {
      "implementation_id": "mister-arcade-scramble",
      "machine_id": "anteater"
    },
    {
      "implementation_id": "mister-arcade-scramble",
      "machine_id": "armorcar"
    },
    {
      "implementation_id": "mister-arcade-scramble",
      "machine_id": "atlantis"
    },
    {
      "implementation_id": "mister-arcade-scramble",
      "machine_id": "calipso"
    },
    {
      "implementation_id": "mister-arcade-scramble",
      "machine_id": "cavelon"
    },
    {
      "implementation_id": "mister-arcade-scramble",
      "machine_id": "darkplnt"
    },
    {
      "implementation_id": "mister-arcade-scramble",
      "machine_id": "frogger"
    },
    {
      "implementation_id": "mister-arcade-scramble",
      "machine_id": "losttomb"
    },
    {
      "implementation_id": "mister-arcade-scramble",
      "machine_id": "mars"
    },
    {
      "implementation_id": "mister-arcade-scramble",
      "machine_id": "mimonkey"
    },
    {
      "implementation_id": "mister-arcade-scramble",
      "machine_id": "minefld"
    },
    {
      "implementation_id": "mister-arcade-scramble",
      "machine_id": "moonwar"
    },
    {
      "implementation_id": "mister-arcade-scramble",
      "machine_id": "rescue"
    },
    {
      "implementation_id": "mister-arcade-scramble",
      "machine_id": "scobra"
    },
    {
      "implementation_id": "mister-arcade-scramble",
      "machine_id": "scramble"
    },
    {
      "implementation_id": "mister-arcade-scramble",
      "machine_id": "spdcoin"
    },
    {
      "implementation_id": "mister-arcade-scramble",
      "machine_id": "stratgyx"
    },
    {
      "implementation_id": "mister-arcade-scramble",
      "machine_id": "tazmania"
    },
    {
      "implementation_id": "mister-arcade-scramble",
      "machine_id": "theend"
    },
    {
      "implementation_id": "mister-arcade-scramble",
      "machine_id": "turtles"
    }
  ],
  "implementation_path": [
    {
      "implementation_id": "mister-arcade-scramble",
      "path": "Arcade-Scramble.sv",
      "is_top": 1
    },
    {
      "implementation_id": "mister-arcade-scramble",
      "path": "rtl"
    }
  ],
  "implementation_platform": [
    {
      "implementation_id": "mister-arcade-scramble",
      "platform_id": "mister"
    }
  ]
}
