{
  "implementation": [
    {
      "implementation_id": "jtgng",
      "name": "JTGNG",
      "kind_id": "fpga_hdl",
      "project_id": "jotego",
      "repo_url": "https://github.com/jotego/jtcores",
      "hdl_language_id": "verilog",
      "license_id": "GPL-3.0-or-later",
      "last_reviewed": "2026-07-28",
      "notes": "Source availability (T5.4): open -- the HDL lives in the jotego/jtcores monorepo at cores/gng/, 50 source files. There is no open_source column in the delivered schema (data-model.md §1.9 deleted the proposed core table together with its flags); the presence of hdl_language_id, license_id and implementation_path rows is how that fact is stated here. License: https://github.com/jotego/jtcores/blob/master/LICENSE is the verbatim GPLv3 text, and the per-file grant in https://github.com/jotego/jtcores/blob/master/cores/gng/hdl/jtgng_char.v reads \"either version 3 of the License, or (at your option) any later version\" -- hence GPL-3.0-or-later. Machine mapping: 12 MRA files in jotego/jtbin's mra/ directory name <rbf>jtgng</rbf>; 1 setnames resolved exactly to a MAME 0.288 machine and 11 through MAME's own cloneof relation to the parent that survives extract/machine.json's parents-only filter, giving 1 distinct machine_id rows. hdl_language_id: 50 of 50 HDL files are verilog (50 verilog), excluding the shared framework directory. accuracy_id omitted: jotego's README claims faithfulness in prose but states no timing-fidelity level this build could check against data/lookup/accuracy_level.json."
    }
  ],
  "implementation_dependency": [
    {
      "consumer_id": "jtgng",
      "provider_id": "jt12",
      "note": "JT12 YM2612/YM2203 FM core, declared in cores/gng/cfg/files.yaml"
    },
    {
      "consumer_id": "jtgng",
      "provider_id": "jtframe",
      "note": "JTFRAME framework, declared in cores/gng/cfg/files.yaml"
    }
  ],
  "implementation_machine": [
    {
      "implementation_id": "jtgng",
      "machine_id": "gng"
    }
  ],
  "implementation_path": [
    {
      "implementation_id": "jtgng",
      "path": "cores/gng/hdl"
    },
    {
      "implementation_id": "jtgng",
      "path": "cores/gng/hdl/jtgng_game.v",
      "is_top": 1
    }
  ],
  "implementation_platform": [
    {
      "implementation_id": "jtgng",
      "platform_id": "mist"
    },
    {
      "implementation_id": "jtgng",
      "platform_id": "mister"
    },
    {
      "implementation_id": "jtgng",
      "platform_id": "pocket"
    }
  ]
}
