{
  "implementation": [
    {
      "implementation_id": "pocket-ericlewis-qbert",
      "name": "Q*Bert (Analogue Pocket, ericlewis)",
      "kind_id": "fpga_hdl",
      "project_id": "ericlewis",
      "repo_url": "https://github.com/ericlewis/openfpga-qbert",
      "hdl_language_id": "mixed",
      "last_reviewed": "2026-07-28",
      "notes": "Source availability (T5.4): open -- the repository carries 58 HDL source files (5 systemverilog, 38 verilog, 15 vhdl). There is no open_source column in the delivered schema (data-model.md §1.9 deleted the proposed core table together with its flags); the presence of hdl_language_id and of implementation_path rows is how that fact is stated here. Machine mapping: this openFPGA core ships 2 MRA files of its own; 2 setnames resolved exactly to a MAME 0.288 machine and 0 through MAME's own cloneof relation, giving 2 distinct machine_id rows. license_id omitted: the repository has no LICENSE, LICENCE or COPYING file at its root and no licence grant was found in the HDL headers read (src/fpga/apf/apf_top.v, src/fpga/apf/common.v, src/fpga/apf/io_bridge_peripheral.v). hdl_language_id: no single HDL family reaches 90% of the 58 source files (5 systemverilog, 38 verilog, 15 vhdl), excluding the shared framework directory. accuracy_id omitted: the repository makes no timing-fidelity claim this build could verify. Core identity read from the openFPGA manifest dist/Cores/ericlewis.QBert/core.json in the repository, which declares core identifier ericlewis.QBert."
    }
  ],
  "implementation_machine": [
    {
      "implementation_id": "pocket-ericlewis-qbert",
      "machine_id": "qbert"
    },
    {
      "implementation_id": "pocket-ericlewis-qbert",
      "machine_id": "qbertqub"
    }
  ],
  "implementation_path": [
    {
      "implementation_id": "pocket-ericlewis-qbert",
      "path": "src"
    }
  ],
  "implementation_platform": [
    {
      "implementation_id": "pocket-ericlewis-qbert",
      "platform_id": "pocket"
    }
  ]
}
