{
  "implementation": [
    {
      "implementation_id": "mister-arcade-pong",
      "name": "Pong (MiSTer)",
      "kind_id": "fpga_hdl",
      "project_id": "mister-devel",
      "repo_url": "https://github.com/MiSTer-devel/Arcade-Pong_MiSTer",
      "hdl_language_id": "verilog",
      "license_id": "GPL-2.0-or-later",
      "last_reviewed": "2026-07-28",
      "notes": "Source availability (T5.4): open -- the repository carries 47 HDL source files (1 systemverilog, 46 verilog) alongside 6 prebuilt .rbf binaries. There is no open_source column in the delivered schema (data-model.md §1.9 deleted the proposed core table together with its flags); the presence of hdl_language_id and of implementation_path rows is how that fact is stated here. Machine mapping: 1 MRA files in the repository's releases/ directory carry a <setname>; 1 resolved exactly to a MAME 0.288 machine and 0 through MAME's own cloneof relation to the parent set that survives extract/machine.json's parents-only filter, giving 1 distinct machine_id rows. License: https://github.com/MiSTer-devel/Arcade-Pong_MiSTer/blob/master/LICENSE is the verbatim GNU GPL version 2 text, and the grant in https://github.com/MiSTer-devel/Arcade-Pong_MiSTer/blob/master/Arcade-Pong.sv reads \"either version 2 of the License, or (at your option) any later version\" -- hence GPL-2.0-or-later. hdl_language_id: 46 of 47 HDL files are verilog (1 systemverilog, 46 verilog), excluding the shared framework directory. accuracy_id omitted: the repository makes no timing-fidelity claim this build could verify."
    }
  ],
  "implementation_machine": [
    {
      "implementation_id": "mister-arcade-pong",
      "machine_id": "pong"
    }
  ],
  "implementation_path": [
    {
      "implementation_id": "mister-arcade-pong",
      "path": "Arcade-Pong.sv",
      "is_top": 1
    },
    {
      "implementation_id": "mister-arcade-pong",
      "path": "rtl"
    }
  ],
  "implementation_platform": [
    {
      "implementation_id": "mister-arcade-pong",
      "platform_id": "mister"
    }
  ]
}
