{
  "implementation": [
    {
      "implementation_id": "jtcal50",
      "name": "JTCAL50",
      "kind_id": "fpga_hdl",
      "project_id": "jotego",
      "repo_url": "https://github.com/jotego/jtcores",
      "hdl_language_id": "verilog",
      "license_id": "GPL-3.0-or-later",
      "last_reviewed": "2026-07-28",
      "notes": "Source availability (T5.4): open -- the HDL lives in the jotego/jtcores monorepo at cores/cal50/, 6 source files. There is no open_source column in the delivered schema (data-model.md §1.9 deleted the proposed core table together with its flags); the presence of hdl_language_id, license_id and implementation_path rows is how that fact is stated here. License: https://github.com/jotego/jtcores/blob/master/LICENSE is the verbatim GPLv3 text, and the per-file grant in https://github.com/jotego/jtcores/blob/master/cores/cal50/hdl/jtcal50_colmix.v reads \"either version 3 of the License, or (at your option) any later version\" -- hence GPL-3.0-or-later. Machine mapping: 1 MRA files in jotego/jtbin's mra/ directory name <rbf>jtcal50</rbf>; 1 setnames resolved exactly to a MAME 0.288 machine and 0 through MAME's own cloneof relation to the parent that survives extract/machine.json's parents-only filter, giving 1 distinct machine_id rows. hdl_language_id: 6 of 6 HDL files are verilog (6 verilog), excluding the shared framework directory. accuracy_id omitted: jotego's README claims faithfulness in prose but states no timing-fidelity level this build could check against data/lookup/accuracy_level.json. cores/cal50/cfg/files.yaml also pulls in jt680x, which have no implementation record yet, so no dependency row is written for them."
    }
  ],
  "implementation_dependency": [
    {
      "consumer_id": "jtcal50",
      "provider_id": "jtframe",
      "note": "JTFRAME framework, declared in cores/cal50/cfg/files.yaml"
    },
    {
      "consumer_id": "jtcal50",
      "provider_id": "jtkiwi",
      "note": "shares HDL with the jtkiwi core, declared in cores/cal50/cfg/files.yaml"
    },
    {
      "consumer_id": "jtcal50",
      "provider_id": "jtx1010",
      "note": "JTX1010 Namco WSG core, declared in cores/cal50/cfg/files.yaml"
    }
  ],
  "implementation_machine": [
    {
      "implementation_id": "jtcal50",
      "machine_id": "calibr50"
    }
  ],
  "implementation_path": [
    {
      "implementation_id": "jtcal50",
      "path": "cores/cal50/hdl"
    },
    {
      "implementation_id": "jtcal50",
      "path": "cores/cal50/hdl/jtcal50_game.v",
      "is_top": 1
    }
  ],
  "implementation_platform": [
    {
      "implementation_id": "jtcal50",
      "platform_id": "mister"
    },
    {
      "implementation_id": "jtcal50",
      "platform_id": "pocket"
    }
  ]
}
