{
  "implementation": [
    {
      "implementation_id": "mister-arcade-mariobros",
      "name": "Mario Bros (MiSTer)",
      "kind_id": "fpga_hdl",
      "project_id": "mister-devel",
      "repo_url": "https://github.com/MiSTer-devel/Arcade-MarioBros_MiSTer",
      "hdl_language_id": "mixed",
      "license_id": "GPL-2.0-or-later",
      "last_reviewed": "2026-07-28",
      "notes": "Source availability (T5.4): open -- the repository carries 107 HDL source files (1 systemverilog, 25 verilog, 81 vhdl) alongside 8 prebuilt .rbf binaries. There is no open_source column in the delivered schema (data-model.md §1.9 deleted the proposed core table together with its flags); the presence of hdl_language_id and of implementation_path rows is how that fact is stated here. Machine mapping: 1 MRA files in the repository's releases/ directory carry a <setname>; 1 resolved exactly to a MAME 0.288 machine and 0 through MAME's own cloneof relation to the parent set that survives extract/machine.json's parents-only filter, giving 1 distinct machine_id rows. License: the repository has no LICENSE, COPYING or COPYRIGHT file; the grant lives in the source header at https://github.com/MiSTer-devel/Arcade-MarioBros_MiSTer/blob/master/Arcade-MarioBros.sv, which offers the work under the GNU General Public License \"either version 2 of the License, or (at your option) any later version\" -- hence GPL-2.0-or-later. hdl_language_id: no single HDL family reaches 90% of the 107 source files (1 systemverilog, 25 verilog, 81 vhdl), excluding the shared framework directory. accuracy_id omitted: the repository makes no timing-fidelity claim this build could verify."
    }
  ],
  "implementation_dependency": [
    {
      "consumer_id": "mister-arcade-mariobros",
      "provider_id": "t48",
      "note": "T48 MCS-48 core vendored at rtl/t48/t48_core.vhd"
    },
    {
      "consumer_id": "mister-arcade-mariobros",
      "provider_id": "t80",
      "note": "T80 Z80 core vendored at rtl/T80/T80.vhd"
    }
  ],
  "implementation_machine": [
    {
      "implementation_id": "mister-arcade-mariobros",
      "machine_id": "mario"
    }
  ],
  "implementation_path": [
    {
      "implementation_id": "mister-arcade-mariobros",
      "path": "Arcade-MarioBros.sv",
      "is_top": 1
    },
    {
      "implementation_id": "mister-arcade-mariobros",
      "path": "rtl"
    }
  ],
  "implementation_platform": [
    {
      "implementation_id": "mister-arcade-mariobros",
      "platform_id": "mister"
    }
  ]
}
