{
  "implementation": [
    {
      "implementation_id": "mister-arcade-rallyx",
      "name": "Rally X (MiSTer)",
      "kind_id": "fpga_hdl",
      "project_id": "mister-devel",
      "repo_url": "https://github.com/MiSTer-devel/Arcade-RallyX_MiSTer",
      "hdl_language_id": "mixed",
      "last_reviewed": "2026-07-28",
      "notes": "Source availability (T5.4): open -- the repository carries 19 HDL source files (1 systemverilog, 11 verilog, 7 vhdl) alongside 10 prebuilt .rbf binaries. There is no open_source column in the delivered schema (data-model.md §1.9 deleted the proposed core table together with its flags); the presence of hdl_language_id and of implementation_path rows is how that fact is stated here. Machine mapping: 2 MRA files in the repository's releases/ directory carry a <setname>; 2 resolved exactly to a MAME 0.288 machine and 0 through MAME's own cloneof relation to the parent set that survives extract/machine.json's parents-only filter, giving 2 distinct machine_id rows. license_id omitted: https://github.com/MiSTer-devel/Arcade-RallyX_MiSTer/blob/master/LICENSE is the verbatim GNU GPL version 3 text, but neither only-this-version nor any-later-version is stated there or in the HDL headers read (Arcade-RallyX.sv), and GPL's version scope comes from the grant, not the licence text. GPL-3.0-only and GPL-3.0-or-later are both consistent with what the repository actually says. hdl_language_id: no single HDL family reaches 90% of the 19 source files (1 systemverilog, 11 verilog, 7 vhdl), excluding the shared framework directory. accuracy_id omitted: the repository makes no timing-fidelity claim this build could verify."
    }
  ],
  "implementation_dependency": [
    {
      "consumer_id": "mister-arcade-rallyx",
      "provider_id": "t80",
      "note": "T80 Z80 core vendored at rtl/cpu/T80.vhd"
    }
  ],
  "implementation_machine": [
    {
      "implementation_id": "mister-arcade-rallyx",
      "machine_id": "nrallyx"
    },
    {
      "implementation_id": "mister-arcade-rallyx",
      "machine_id": "rallyx"
    }
  ],
  "implementation_path": [
    {
      "implementation_id": "mister-arcade-rallyx",
      "path": "Arcade-RallyX.sv",
      "is_top": 1
    },
    {
      "implementation_id": "mister-arcade-rallyx",
      "path": "rtl"
    }
  ],
  "implementation_platform": [
    {
      "implementation_id": "mister-arcade-rallyx",
      "platform_id": "mister"
    }
  ]
}
